{
  "schema_version": "1.0.0",
  "bundle_id": "103c479e248ad317",
  "cve_id": "CVE-2025-12819",
  "nixpkgs_rev": "f7880cff343dd33533b05866afd059655ce25418",
  "kind": "auto-merge",
  "auto_merge_evidence_path": "reviewer-attested",
  "created_at": "2026-06-09T14:34:43Z",
  "policy_version": "0000000000000000000000000000000000000000000000000000000000000000",
  "bundle_schema_version": "1111111111111111111111111111111111111111111111111111111111111111",
  "files": {
    "bundle.json": {
      "sha256": "dddddddddddddddddddddddddddddddddddddddddddddddddddddddddddddddd",
      "bytes": 256,
      "producer_role": "steward",
      "replay_critical": true
    },
    "finding.json": {
      "sha256": "989133b1bf98fe1b0c3bacb286590a7d8bd723f9ae06c61ef4cd481e4348ae27",
      "bytes": 824,
      "producer_role": "scout",
      "replay_critical": true
    },
    "impact.json": {
      "sha256": "9118c3717ca192bab17416b6d43c8cc2c087d378a7f652f762b4123fe06480ea",
      "bytes": 798,
      "producer_role": "cartographer",
      "replay_critical": true
    },
    "maintainers.json": {
      "sha256": "f07ececc67d10349a504e302e9a2939fc5fd5624585fa6657d59439b735f7542",
      "bytes": 279,
      "producer_role": "cartographer",
      "replay_critical": true
    },
    "upstream-ref.json": {
      "sha256": "51e98953fc0a0c798187f83cb599e043430679d32d39b628f341d08673a9aad2",
      "bytes": 1639,
      "producer_role": "upstream-ref-resolver",
      "replay_critical": true
    },
    "patch.diff": {
      "sha256": "520fd67f3cd78684e518ab23a5d508126d0db7f54588c881480d802ceade0342",
      "bytes": 687,
      "producer_role": "patcher",
      "replay_critical": true
    },
    "patch-rationale.md": {
      "sha256": "f95cf154cce9460428243924aa156cf88cadbc1e9187306cc266e190c6021e18",
      "bytes": 1875,
      "producer_role": "patcher",
      "replay_critical": true
    },
    "passthru-tests.json": {
      "sha256": "bf867564b27e2507139662c5e129c0cec11d089b1679e9fc2b936c4bbaabbca5",
      "bytes": 75,
      "producer_role": "reproducer",
      "replay_critical": true
    },
    "reproducer-refusal.json": {
      "sha256": "b3fcf04c1b6692bdc7ffdcf6c3722846039972c1dd86fd5de95aa96c2dc7c258",
      "bytes": 400,
      "producer_role": "reproducer",
      "replay_critical": true
    },
    "build.json": {
      "sha256": "e872ba5493513418ebe9753d15bcbd85681e9207ad72142193666eda568e02a1",
      "bytes": 17167,
      "producer_role": "builder",
      "replay_critical": false
    },
    "review.md": {
      "sha256": "a613ffa900389e73a00d948ba35000ebb17e39d07d90349d069e58f973b8c4eb",
      "bytes": 1482,
      "producer_role": "reviewer",
      "replay_critical": true
    },
    "review-scoring-report.json": {
      "sha256": "787b7c16fb7ea1c81232cd47dd6b43de97786aa48b57b36f2661006acfe6a195",
      "bytes": 2353,
      "producer_role": "reviewer",
      "replay_critical": false
    },
    "sbom-delta.json": {
      "sha256": "370881c2d9a8f4871971724bff4726afdd825a1680194dd99caa40c7b151e418",
      "bytes": 138,
      "producer_role": "upstream-ref-resolver",
      "replay_critical": true
    },
    "replay.json": {
      "sha256": "8d27f741b28c65c1498fb6ab41acffbadfb712d2ee5cfc332a995f81d7fe09ac",
      "bytes": 9192,
      "producer_role": "steward",
      "replay_critical": true
    },
    "provenance.jsonl": {
      "sha256": "dddddddddddddddddddddddddddddddddddddddddddddddddddddddddddddddd",
      "bytes": 256,
      "producer_role": "steward",
      "replay_critical": false
    },
    "bundle.sig": {
      "sha256": "dddddddddddddddddddddddddddddddddddddddddddddddddddddddddddddddd",
      "bytes": 256,
      "producer_role": "steward",
      "replay_critical": false
    }
  },
  "signed_manifest": {
    "algorithm": "sigstore-cosign-v1",
    "signer": "trace-dev@adastracomputing.com",
    "signed_files": [
      {
        "path": "bundle.json",
        "sha256": "dddddddddddddddddddddddddddddddddddddddddddddddddddddddddddddddd"
      },
      {
        "path": "finding.json",
        "sha256": "989133b1bf98fe1b0c3bacb286590a7d8bd723f9ae06c61ef4cd481e4348ae27"
      },
      {
        "path": "impact.json",
        "sha256": "9118c3717ca192bab17416b6d43c8cc2c087d378a7f652f762b4123fe06480ea"
      },
      {
        "path": "maintainers.json",
        "sha256": "f07ececc67d10349a504e302e9a2939fc5fd5624585fa6657d59439b735f7542"
      },
      {
        "path": "upstream-ref.json",
        "sha256": "51e98953fc0a0c798187f83cb599e043430679d32d39b628f341d08673a9aad2"
      },
      {
        "path": "patch.diff",
        "sha256": "520fd67f3cd78684e518ab23a5d508126d0db7f54588c881480d802ceade0342"
      },
      {
        "path": "patch-rationale.md",
        "sha256": "f95cf154cce9460428243924aa156cf88cadbc1e9187306cc266e190c6021e18"
      },
      {
        "path": "passthru-tests.json",
        "sha256": "bf867564b27e2507139662c5e129c0cec11d089b1679e9fc2b936c4bbaabbca5"
      },
      {
        "path": "reproducer-refusal.json",
        "sha256": "b3fcf04c1b6692bdc7ffdcf6c3722846039972c1dd86fd5de95aa96c2dc7c258"
      },
      {
        "path": "review.md",
        "sha256": "a613ffa900389e73a00d948ba35000ebb17e39d07d90349d069e58f973b8c4eb"
      },
      {
        "path": "sbom-delta.json",
        "sha256": "370881c2d9a8f4871971724bff4726afdd825a1680194dd99caa40c7b151e418"
      },
      {
        "path": "replay.json",
        "sha256": "8d27f741b28c65c1498fb6ab41acffbadfb712d2ee5cfc332a995f81d7fe09ac"
      }
    ]
  }
}
