{
  "schema_version": "1.0.0",
  "bundle_id": "afca15769fbfeda2",
  "cve_id": "CVE-2025-9230",
  "nixpkgs_rev": "1453647d2294bdaa8942aa9ace7256ff4fa230af",
  "kind": "human-review-required",
  "kind_reason": "blast-radius-exceeds-threshold",
  "created_at": "2026-04-27T21:20:38Z",
  "policy_version": "0000000000000000000000000000000000000000000000000000000000000000",
  "bundle_schema_version": "1111111111111111111111111111111111111111111111111111111111111111",
  "files": {
    "bundle.json": {
      "sha256": "dddddddddddddddddddddddddddddddddddddddddddddddddddddddddddddddd",
      "bytes": 256,
      "producer_role": "steward",
      "replay_critical": true
    },
    "finding.json": {
      "sha256": "110c135ffeb3472adcc1af6679bf3a2820a224cc6df9c510a5847d52738c804d",
      "bytes": 877,
      "producer_role": "scout",
      "replay_critical": true
    },
    "impact.json": {
      "sha256": "0493d89ee2fe07bc6a5f9387e7533b6249bb49740006a99673737fe0d45ecb71",
      "bytes": 1096,
      "producer_role": "cartographer",
      "replay_critical": true
    },
    "maintainers.json": {
      "sha256": "bbf87b9e7ff7e787afc6b8e6b10152b3665ccbf4c453bb22fffa3841f7e82481",
      "bytes": 260,
      "producer_role": "cartographer",
      "replay_critical": true
    },
    "upstream-ref.json": {
      "sha256": "067a120e8f52b0f876ff43e4bfdd94a51ed46c241c78af50acf618e57fa147a5",
      "bytes": 1527,
      "producer_role": "upstream-ref-resolver",
      "replay_critical": true
    },
    "patch.diff": {
      "sha256": "3ad4fd0a2f059caec810146163a17b334b49ba2862f293723bd36abbb24e53f3",
      "bytes": 343,
      "producer_role": "patcher",
      "replay_critical": true
    },
    "patch-rationale.md": {
      "sha256": "fc2c2b390559c4af9ffd157a45db0656f476fca9430b44d2699c2d80c5187149",
      "bytes": 2295,
      "producer_role": "patcher",
      "replay_critical": true
    },
    "passthru-tests.json": {
      "sha256": "dddddddddddddddddddddddddddddddddddddddddddddddddddddddddddddddd",
      "bytes": 256,
      "producer_role": "reproducer",
      "replay_critical": true
    },
    "reproducer.nix": {
      "sha256": "dddddddddddddddddddddddddddddddddddddddddddddddddddddddddddddddd",
      "bytes": 256,
      "producer_role": "reproducer",
      "replay_critical": true
    },
    "reproducer-log.txt": {
      "sha256": "dddddddddddddddddddddddddddddddddddddddddddddddddddddddddddddddd",
      "bytes": 256,
      "producer_role": "reproducer",
      "replay_critical": false
    },
    "build.json": {
      "sha256": "dddddddddddddddddddddddddddddddddddddddddddddddddddddddddddddddd",
      "bytes": 256,
      "producer_role": "builder",
      "replay_critical": false
    },
    "review.md": {
      "sha256": "dddddddddddddddddddddddddddddddddddddddddddddddddddddddddddddddd",
      "bytes": 256,
      "producer_role": "reviewer",
      "replay_critical": true
    },
    "sbom-delta.json": {
      "sha256": "dddddddddddddddddddddddddddddddddddddddddddddddddddddddddddddddd",
      "bytes": 256,
      "producer_role": "upstream-ref-resolver",
      "replay_critical": true
    },
    "replay.json": {
      "sha256": "898d56eb6869f3ca38f89dbecfd8e756a4b3e49969960e61a997ebcffeabd818",
      "bytes": 1569,
      "producer_role": "steward",
      "replay_critical": true
    },
    "provenance.jsonl": {
      "sha256": "dddddddddddddddddddddddddddddddddddddddddddddddddddddddddddddddd",
      "bytes": 256,
      "producer_role": "steward",
      "replay_critical": false
    },
    "bundle.sig": {
      "sha256": "dddddddddddddddddddddddddddddddddddddddddddddddddddddddddddddddd",
      "bytes": 256,
      "producer_role": "steward",
      "replay_critical": false
    }
  },
  "signed_manifest": {
    "algorithm": "sigstore-cosign-v1",
    "signer": "trace-dev@adastracomputing.com",
    "signed_files": [
      {
        "path": "bundle.json",
        "sha256": "dddddddddddddddddddddddddddddddddddddddddddddddddddddddddddddddd"
      },
      {
        "path": "finding.json",
        "sha256": "110c135ffeb3472adcc1af6679bf3a2820a224cc6df9c510a5847d52738c804d"
      },
      {
        "path": "impact.json",
        "sha256": "0493d89ee2fe07bc6a5f9387e7533b6249bb49740006a99673737fe0d45ecb71"
      },
      {
        "path": "maintainers.json",
        "sha256": "bbf87b9e7ff7e787afc6b8e6b10152b3665ccbf4c453bb22fffa3841f7e82481"
      },
      {
        "path": "upstream-ref.json",
        "sha256": "067a120e8f52b0f876ff43e4bfdd94a51ed46c241c78af50acf618e57fa147a5"
      },
      {
        "path": "patch.diff",
        "sha256": "3ad4fd0a2f059caec810146163a17b334b49ba2862f293723bd36abbb24e53f3"
      },
      {
        "path": "patch-rationale.md",
        "sha256": "fc2c2b390559c4af9ffd157a45db0656f476fca9430b44d2699c2d80c5187149"
      },
      {
        "path": "passthru-tests.json",
        "sha256": "dddddddddddddddddddddddddddddddddddddddddddddddddddddddddddddddd"
      },
      {
        "path": "reproducer.nix",
        "sha256": "dddddddddddddddddddddddddddddddddddddddddddddddddddddddddddddddd"
      },
      {
        "path": "review.md",
        "sha256": "dddddddddddddddddddddddddddddddddddddddddddddddddddddddddddddddd"
      },
      {
        "path": "sbom-delta.json",
        "sha256": "dddddddddddddddddddddddddddddddddddddddddddddddddddddddddddddddd"
      },
      {
        "path": "replay.json",
        "sha256": "898d56eb6869f3ca38f89dbecfd8e756a4b3e49969960e61a997ebcffeabd818"
      }
    ]
  }
}
