{
  "schema_version": "1.0.0",
  "bundle_id": "8083f6eb5d1dc655",
  "cve_id": "CVE-2025-67899",
  "nixpkgs_rev": "20bb5d462943a0f38eba2372db9f7a6d9fd22be2",
  "kind": "human-review-required",
  "kind_reason": "major-version-jump-requires-review",
  "created_at": "2026-04-27T21:12:27Z",
  "policy_version": "0000000000000000000000000000000000000000000000000000000000000000",
  "bundle_schema_version": "1111111111111111111111111111111111111111111111111111111111111111",
  "files": {
    "bundle.json": {
      "sha256": "dddddddddddddddddddddddddddddddddddddddddddddddddddddddddddddddd",
      "bytes": 256,
      "producer_role": "steward",
      "replay_critical": true
    },
    "finding.json": {
      "sha256": "aa41228352dd16d581902367f79e31f7e14df467ceb29c42451cf298d3f674ed",
      "bytes": 792,
      "producer_role": "scout",
      "replay_critical": true
    },
    "impact.json": {
      "sha256": "0b53e2824a2c3a7046576abeb12e887924f7cdfa2d9105f3b870fb1afe885c6b",
      "bytes": 870,
      "producer_role": "cartographer",
      "replay_critical": true
    },
    "maintainers.json": {
      "sha256": "624f25c7c9b2d353ba8099d7505bbb9af28e217f312e5c3d52eef1d13762de79",
      "bytes": 258,
      "producer_role": "cartographer",
      "replay_critical": true
    },
    "upstream-ref.json": {
      "sha256": "f1b95db7768a978856199b0dd094e725989534ed31a7c39bfd547886b666f8b8",
      "bytes": 1840,
      "producer_role": "upstream-ref-resolver",
      "replay_critical": true
    },
    "patch.diff": {
      "sha256": "dddddddddddddddddddddddddddddddddddddddddddddddddddddddddddddddd",
      "bytes": 256,
      "producer_role": "patcher",
      "replay_critical": true
    },
    "patch-rationale.md": {
      "sha256": "dddddddddddddddddddddddddddddddddddddddddddddddddddddddddddddddd",
      "bytes": 256,
      "producer_role": "patcher",
      "replay_critical": true
    },
    "passthru-tests.json": {
      "sha256": "dddddddddddddddddddddddddddddddddddddddddddddddddddddddddddddddd",
      "bytes": 256,
      "producer_role": "reproducer",
      "replay_critical": true
    },
    "reproducer.nix": {
      "sha256": "dddddddddddddddddddddddddddddddddddddddddddddddddddddddddddddddd",
      "bytes": 256,
      "producer_role": "reproducer",
      "replay_critical": true
    },
    "reproducer-log.txt": {
      "sha256": "dddddddddddddddddddddddddddddddddddddddddddddddddddddddddddddddd",
      "bytes": 256,
      "producer_role": "reproducer",
      "replay_critical": false
    },
    "build.json": {
      "sha256": "dddddddddddddddddddddddddddddddddddddddddddddddddddddddddddddddd",
      "bytes": 256,
      "producer_role": "builder",
      "replay_critical": false
    },
    "review.md": {
      "sha256": "dddddddddddddddddddddddddddddddddddddddddddddddddddddddddddddddd",
      "bytes": 256,
      "producer_role": "reviewer",
      "replay_critical": true
    },
    "sbom-delta.json": {
      "sha256": "dddddddddddddddddddddddddddddddddddddddddddddddddddddddddddddddd",
      "bytes": 256,
      "producer_role": "upstream-ref-resolver",
      "replay_critical": true
    },
    "replay.json": {
      "sha256": "b05d4e4588021db4bb59341673fae5058c1398686f4c27818224960dcd3baee3",
      "bytes": 1569,
      "producer_role": "steward",
      "replay_critical": true
    },
    "provenance.jsonl": {
      "sha256": "dddddddddddddddddddddddddddddddddddddddddddddddddddddddddddddddd",
      "bytes": 256,
      "producer_role": "steward",
      "replay_critical": false
    },
    "bundle.sig": {
      "sha256": "dddddddddddddddddddddddddddddddddddddddddddddddddddddddddddddddd",
      "bytes": 256,
      "producer_role": "steward",
      "replay_critical": false
    }
  },
  "signed_manifest": {
    "algorithm": "sigstore-cosign-v1",
    "signer": "trace-dev@adastracomputing.com",
    "signed_files": [
      {
        "path": "bundle.json",
        "sha256": "dddddddddddddddddddddddddddddddddddddddddddddddddddddddddddddddd"
      },
      {
        "path": "finding.json",
        "sha256": "aa41228352dd16d581902367f79e31f7e14df467ceb29c42451cf298d3f674ed"
      },
      {
        "path": "impact.json",
        "sha256": "0b53e2824a2c3a7046576abeb12e887924f7cdfa2d9105f3b870fb1afe885c6b"
      },
      {
        "path": "maintainers.json",
        "sha256": "624f25c7c9b2d353ba8099d7505bbb9af28e217f312e5c3d52eef1d13762de79"
      },
      {
        "path": "upstream-ref.json",
        "sha256": "f1b95db7768a978856199b0dd094e725989534ed31a7c39bfd547886b666f8b8"
      },
      {
        "path": "patch.diff",
        "sha256": "dddddddddddddddddddddddddddddddddddddddddddddddddddddddddddddddd"
      },
      {
        "path": "patch-rationale.md",
        "sha256": "dddddddddddddddddddddddddddddddddddddddddddddddddddddddddddddddd"
      },
      {
        "path": "passthru-tests.json",
        "sha256": "dddddddddddddddddddddddddddddddddddddddddddddddddddddddddddddddd"
      },
      {
        "path": "reproducer.nix",
        "sha256": "dddddddddddddddddddddddddddddddddddddddddddddddddddddddddddddddd"
      },
      {
        "path": "review.md",
        "sha256": "dddddddddddddddddddddddddddddddddddddddddddddddddddddddddddddddd"
      },
      {
        "path": "sbom-delta.json",
        "sha256": "dddddddddddddddddddddddddddddddddddddddddddddddddddddddddddddddd"
      },
      {
        "path": "replay.json",
        "sha256": "b05d4e4588021db4bb59341673fae5058c1398686f4c27818224960dcd3baee3"
      }
    ]
  }
}
