{
  "schema_version": "1.0.0",
  "bundle_id": "placeholder-partial-hunk",
  "cve_id": "CVE-2023-4016",
  "nixpkgs_rev": "63678e9f3d3afecfeafa0acead6239cdb447574c",
  "kind": "human-review-required",
  "kind_reason": "source-backport-experimental",
  "auto_merge_evidence_path": "reviewer-attested",
  "created_at": "2026-06-21T04:32:00Z",
  "policy_version": "0000000000000000000000000000000000000000000000000000000000000000",
  "bundle_schema_version": "1111111111111111111111111111111111111111111111111111111111111111",
  "files": {
    "bundle.json": {
      "sha256": "dddddddddddddddddddddddddddddddddddddddddddddddddddddddddddddddd",
      "bytes": 256,
      "producer_role": "steward",
      "replay_critical": true
    },
    "finding.json": {
      "sha256": "95fdac30dfc0d4210373cbb431d1c7c9b4764318c3a0c86fadeeb833059d67cf",
      "bytes": 1302,
      "producer_role": "scout",
      "replay_critical": true
    },
    "impact.json": {
      "sha256": "91057d2b08a56572d2668e8e8abaa43f853c935e1db3e1b98dc87e2b093b10f2",
      "bytes": 785,
      "producer_role": "cartographer",
      "replay_critical": true
    },
    "maintainers.json": {
      "sha256": "812a28abfab8aa317bca395085aa100b7ba437b28b70b550cec6a5e1ca0e0d84",
      "bytes": 218,
      "producer_role": "cartographer",
      "replay_critical": true
    },
    "upstream-ref.json": {
      "sha256": "220c9b9e99834b2a68fb33bef7e55ee344e1964f278578a25674dbfe3a3c3ad0",
      "bytes": 2200,
      "producer_role": "upstream-ref-resolver",
      "replay_critical": true
    },
    "patch.diff": {
      "sha256": "eca6551cbe199edbf7b87c39fece0bf9d76a3ecd779e1a77092b560bdef5d8cd",
      "bytes": 3103,
      "producer_role": "patcher",
      "replay_critical": true
    },
    "patch-rationale.md": {
      "sha256": "55b81d2dc9329fd10972f9d2f8b40de30a7e6d1cca0389741c6d3c44378daefa",
      "bytes": 2633,
      "producer_role": "patcher",
      "replay_critical": true
    },
    "passthru-tests.json": {
      "sha256": "dddddddddddddddddddddddddddddddddddddddddddddddddddddddddddddddd",
      "bytes": 256,
      "producer_role": "reproducer",
      "replay_critical": true
    },
    "reproducer-refusal.json": {
      "sha256": "dddddddddddddddddddddddddddddddddddddddddddddddddddddddddddddddd",
      "bytes": 256,
      "producer_role": "reproducer",
      "replay_critical": true
    },
    "build.json": {
      "sha256": "40e21d686e33256df6831f6290a5e9fe46735d404cc99cbe99bb0e5570ae1b07",
      "bytes": 70067,
      "producer_role": "builder",
      "replay_critical": false
    },
    "review.md": {
      "sha256": "b871b911a8da93c6da50126d19f26f80c6bdf5015e0855433fa234f94440f1ed",
      "bytes": 2052,
      "producer_role": "reviewer",
      "replay_critical": true
    },
    "review-scoring-report.json": {
      "sha256": "4e7a8e6a192468c2dee2614318f5e69ca46371a5886b4f6da1c44dbac04002d5",
      "bytes": 2083,
      "producer_role": "reviewer",
      "replay_critical": false
    },
    "sbom-delta.json": {
      "sha256": "dddddddddddddddddddddddddddddddddddddddddddddddddddddddddddddddd",
      "bytes": 256,
      "producer_role": "upstream-ref-resolver",
      "replay_critical": true
    },
    "replay.json": {
      "sha256": "51d66733d2d401b75d2d7517e4fb60c04f54f786074d8d62aefddcb9cdcf7517",
      "bytes": 9479,
      "producer_role": "steward",
      "replay_critical": true
    },
    "provenance.jsonl": {
      "sha256": "dddddddddddddddddddddddddddddddddddddddddddddddddddddddddddddddd",
      "bytes": 256,
      "producer_role": "steward",
      "replay_critical": false
    },
    "bundle.sig": {
      "sha256": "dddddddddddddddddddddddddddddddddddddddddddddddddddddddddddddddd",
      "bytes": 256,
      "producer_role": "steward",
      "replay_critical": false
    },
    "upstream-fix.patch": {
      "sha256": "325018fa98d033bb50629a070c9c896720bed414b3a19c23d19fcfb083e652b5",
      "bytes": 2252,
      "producer_role": "upstream-ref-resolver",
      "replay_critical": true
    }
  },
  "signed_manifest": {
    "algorithm": "sigstore-cosign-v1",
    "signer": "trace-dev@adastracomputing.com",
    "signed_files": [
      {
        "path": "bundle.json",
        "sha256": "dddddddddddddddddddddddddddddddddddddddddddddddddddddddddddddddd"
      },
      {
        "path": "finding.json",
        "sha256": "95fdac30dfc0d4210373cbb431d1c7c9b4764318c3a0c86fadeeb833059d67cf"
      },
      {
        "path": "impact.json",
        "sha256": "91057d2b08a56572d2668e8e8abaa43f853c935e1db3e1b98dc87e2b093b10f2"
      },
      {
        "path": "maintainers.json",
        "sha256": "812a28abfab8aa317bca395085aa100b7ba437b28b70b550cec6a5e1ca0e0d84"
      },
      {
        "path": "upstream-ref.json",
        "sha256": "220c9b9e99834b2a68fb33bef7e55ee344e1964f278578a25674dbfe3a3c3ad0"
      },
      {
        "path": "patch.diff",
        "sha256": "eca6551cbe199edbf7b87c39fece0bf9d76a3ecd779e1a77092b560bdef5d8cd"
      },
      {
        "path": "patch-rationale.md",
        "sha256": "55b81d2dc9329fd10972f9d2f8b40de30a7e6d1cca0389741c6d3c44378daefa"
      },
      {
        "path": "passthru-tests.json",
        "sha256": "dddddddddddddddddddddddddddddddddddddddddddddddddddddddddddddddd"
      },
      {
        "path": "reproducer-refusal.json",
        "sha256": "dddddddddddddddddddddddddddddddddddddddddddddddddddddddddddddddd"
      },
      {
        "path": "review.md",
        "sha256": "b871b911a8da93c6da50126d19f26f80c6bdf5015e0855433fa234f94440f1ed"
      },
      {
        "path": "sbom-delta.json",
        "sha256": "dddddddddddddddddddddddddddddddddddddddddddddddddddddddddddddddd"
      },
      {
        "path": "replay.json",
        "sha256": "51d66733d2d401b75d2d7517e4fb60c04f54f786074d8d62aefddcb9cdcf7517"
      },
      {
        "path": "upstream-fix.patch",
        "sha256": "325018fa98d033bb50629a070c9c896720bed414b3a19c23d19fcfb083e652b5"
      }
    ]
  }
}
