{
  "schema_version": "1.0.0",
  "bundle_id": "8a6fa90cd1692fce",
  "cve_id": "CVE-2026-84206",
  "nixpkgs_rev": "17de0b976395537756f30a3e78f2f06e5cec89ed",
  "kind": "human-review-required",
  "kind_reason": "source-backport-experimental",
  "auto_merge_evidence_path": "reviewer-attested",
  "created_at": "2026-09-07T09:00:00Z",
  "policy_version": "0000000000000000000000000000000000000000000000000000000000000000",
  "bundle_schema_version": "1111111111111111111111111111111111111111111111111111111111111111",
  "files": {
    "bundle.json": {
      "sha256": "dddddddddddddddddddddddddddddddddddddddddddddddddddddddddddddddd",
      "bytes": 256,
      "producer_role": "steward",
      "replay_critical": true
    },
    "finding.json": {
      "sha256": "a30340b3b50aef2b00c69441279dbaba08a758287954b45d60d3f274f85f5b38",
      "bytes": 2520,
      "producer_role": "scout",
      "replay_critical": true
    },
    "impact.json": {
      "sha256": "4c5e5723e53a34e1d8308489db8aff139c74f738916b7f07e01fc0138409a454",
      "bytes": 1053,
      "producer_role": "cartographer",
      "replay_critical": true
    },
    "maintainers.json": {
      "sha256": "f916cae0046c6d1a0bc2a57c1d4486f0f6a427e9cd841ac7db96d65d02bee44b",
      "bytes": 221,
      "producer_role": "cartographer",
      "replay_critical": true
    },
    "upstream-ref.json": {
      "sha256": "778cd59c7b504c996d397ac1c8e274439f7078328412a674a117a0113f122fc3",
      "bytes": 2385,
      "producer_role": "upstream-ref-resolver",
      "replay_critical": true
    },
    "patch.diff": {
      "sha256": "4d40863425b7271df29f05384805bebddbb54076b8379ce78250b0ca27dc622d",
      "bytes": 2278,
      "producer_role": "patcher",
      "replay_critical": true
    },
    "patch-rationale.md": {
      "sha256": "6b5ef4ad2f34f65e663efc499c9aec4813634af6ef5667fece145cdb315b362b",
      "bytes": 3017,
      "producer_role": "patcher",
      "replay_critical": true
    },
    "passthru-tests.json": {
      "sha256": "dddddddddddddddddddddddddddddddddddddddddddddddddddddddddddddddd",
      "bytes": 256,
      "producer_role": "reproducer",
      "replay_critical": true
    },
    "reproducer-refusal.json": {
      "sha256": "2e5d3f6488d11a7128871f6898fad3388e5e6d19bdf24f93fdc3a79544092436",
      "bytes": 2329,
      "producer_role": "reproducer",
      "replay_critical": true
    },
    "build.json": {
      "sha256": "50e9f9140fdd75f9d498d046fe5df4079e817ea163c39efc51e4f8d74513fea9",
      "bytes": 57513,
      "producer_role": "builder",
      "replay_critical": false
    },
    "review.md": {
      "sha256": "1cdcfae3b3ca7f00b8ae452c5e7b0416c8521e6c934b5ef09c61fcf22b3ecf10",
      "bytes": 5890,
      "producer_role": "reviewer",
      "replay_critical": true
    },
    "review-scoring-report.json": {
      "sha256": "dddddddddddddddddddddddddddddddddddddddddddddddddddddddddddddddd",
      "bytes": 256,
      "producer_role": "reviewer",
      "replay_critical": false
    },
    "sbom-delta.json": {
      "sha256": "dddddddddddddddddddddddddddddddddddddddddddddddddddddddddddddddd",
      "bytes": 256,
      "producer_role": "upstream-ref-resolver",
      "replay_critical": true
    },
    "replay.json": {
      "sha256": "a26e0a0e01d3544567af8d5ff56bb8c0a9ee96008bb6e15895b1cfb0e3a7d3d9",
      "bytes": 16746,
      "producer_role": "steward",
      "replay_critical": true
    },
    "provenance.jsonl": {
      "sha256": "dddddddddddddddddddddddddddddddddddddddddddddddddddddddddddddddd",
      "bytes": 256,
      "producer_role": "steward",
      "replay_critical": false
    },
    "bundle.sig": {
      "sha256": "dddddddddddddddddddddddddddddddddddddddddddddddddddddddddddddddd",
      "bytes": 256,
      "producer_role": "steward",
      "replay_critical": false
    },
    "upstream-fix.patch": {
      "sha256": "6c885da471f4b8c4f027c2bd76148768a1b44bd2c9c1837fa4c9286381dc5489",
      "bytes": 5663,
      "producer_role": "upstream-ref-resolver",
      "replay_critical": true
    }
  },
  "signed_manifest": {
    "algorithm": "sigstore-cosign-v1",
    "signer": "https://github.com/Ad-Astra-Computing/trace/.github/workflows/steward.yml@refs/heads/main",
    "signed_files": [
      {
        "path": "bundle.json",
        "sha256": "dddddddddddddddddddddddddddddddddddddddddddddddddddddddddddddddd"
      },
      {
        "path": "finding.json",
        "sha256": "a30340b3b50aef2b00c69441279dbaba08a758287954b45d60d3f274f85f5b38"
      },
      {
        "path": "impact.json",
        "sha256": "4c5e5723e53a34e1d8308489db8aff139c74f738916b7f07e01fc0138409a454"
      },
      {
        "path": "maintainers.json",
        "sha256": "f916cae0046c6d1a0bc2a57c1d4486f0f6a427e9cd841ac7db96d65d02bee44b"
      },
      {
        "path": "upstream-ref.json",
        "sha256": "778cd59c7b504c996d397ac1c8e274439f7078328412a674a117a0113f122fc3"
      },
      {
        "path": "patch.diff",
        "sha256": "4d40863425b7271df29f05384805bebddbb54076b8379ce78250b0ca27dc622d"
      },
      {
        "path": "patch-rationale.md",
        "sha256": "6b5ef4ad2f34f65e663efc499c9aec4813634af6ef5667fece145cdb315b362b"
      },
      {
        "path": "passthru-tests.json",
        "sha256": "dddddddddddddddddddddddddddddddddddddddddddddddddddddddddddddddd"
      },
      {
        "path": "reproducer-refusal.json",
        "sha256": "2e5d3f6488d11a7128871f6898fad3388e5e6d19bdf24f93fdc3a79544092436"
      },
      {
        "path": "review.md",
        "sha256": "1cdcfae3b3ca7f00b8ae452c5e7b0416c8521e6c934b5ef09c61fcf22b3ecf10"
      },
      {
        "path": "sbom-delta.json",
        "sha256": "dddddddddddddddddddddddddddddddddddddddddddddddddddddddddddddddd"
      },
      {
        "path": "replay.json",
        "sha256": "a26e0a0e01d3544567af8d5ff56bb8c0a9ee96008bb6e15895b1cfb0e3a7d3d9"
      },
      {
        "path": "upstream-fix.patch",
        "sha256": "6c885da471f4b8c4f027c2bd76148768a1b44bd2c9c1837fa4c9286381dc5489"
      }
    ],
    "identity_subject": "https://github.com/Ad-Astra-Computing/trace/.github/workflows/steward.yml@refs/heads/main",
    "identity_issuer": "https://token.actions.githubusercontent.com",
    "rekor_log_index": 2752469020,
    "rekor_uuid": "108e9186e8c5677a2a91b8028be395c6ef1a528401db8ee84f5b1d5be17fd83bb5a83147abfc5ece"
  }
}
