{
  "schema_version": "1.0.0",
  "bundle_id": "0000000000000018",
  "cve_id": "CVE-0000-0018",
  "nixpkgs_rev": "0000000000000000000000000000000000000000",
  "kind": "auto-merge",
  "created_at": "2026-04-23T00:00:00Z",
  "policy_version": "0000000000000000000000000000000000000000000000000000000000000000",
  "bundle_schema_version": "1111111111111111111111111111111111111111111111111111111111111111",
  "files": {
    "bundle.json": {
      "sha256": "aaaaaaaaaaaaaaaaaaaaaaaaaaaaaaaaaaaaaaaaaaaaaaaaaaaaaaaaaaaaaa10",
      "bytes": 1024,
      "producer_role": "steward",
      "replay_critical": true
    },
    "finding.json": {
      "sha256": "bbbbbbbbbbbbbbbbbbbbbbbbbbbbbbbbbbbbbbbbbbbbbbbbbbbbbbbbbbbbbb10",
      "bytes": 1024,
      "producer_role": "scout",
      "replay_critical": true
    },
    "impact.json": {
      "sha256": "dddddddddddddddddddddddddddddddddddddddddddddddddddddddddddddd10",
      "bytes": 512,
      "producer_role": "cartographer",
      "replay_critical": true
    },
    "maintainers.json": {
      "sha256": "eeeeeeeeeeeeeeeeeeeeeeeeeeeeeeeeeeeeeeeeeeeeeeeeeeeeeeeeeeeeee10",
      "bytes": 256,
      "producer_role": "cartographer",
      "replay_critical": true
    },
    "upstream-ref.json": {
      "sha256": "cccccccccccccccccccccccccccccccccccccccccccccccccccccccccccccc10",
      "bytes": 512,
      "producer_role": "upstream-ref-resolver",
      "replay_critical": true
    },
    "patch.diff": {
      "sha256": "dddddddddddddddddddddddddddddddddddddddddddddddddddddddddddddddd",
      "bytes": 256,
      "producer_role": "patcher",
      "replay_critical": true
    },
    "patch-rationale.md": {
      "sha256": "4040404040404040404040404040404040404040404040404040404040404040",
      "bytes": 512,
      "producer_role": "patcher",
      "replay_critical": true
    },
    "passthru-tests.json": {
      "sha256": "5050505050505050505050505050505050505050505050505050505050505050",
      "bytes": 256,
      "producer_role": "reproducer",
      "replay_critical": true
    },
    "reproducer.nix": {
      "sha256": "6161616161616161616161616161616161616161616161616161616161616161",
      "bytes": 1024,
      "producer_role": "reproducer",
      "replay_critical": true
    },
    "reproducer-log.txt": {
      "sha256": "6060606060606060606060606060606060606060606060606060606060606060",
      "bytes": 1024,
      "producer_role": "reproducer",
      "replay_critical": false
    },
    "build.json": {
      "sha256": "7070707070707070707070707070707070707070707070707070707070707011",
      "bytes": 2048,
      "producer_role": "builder",
      "replay_critical": false
    },
    "review.md": {
      "sha256": "8181818181818181818181818181818181818181818181818181818181818181",
      "bytes": 1024,
      "producer_role": "reviewer",
      "replay_critical": true
    },
    "sbom-delta.json": {
      "sha256": "9191919191919191919191919191919191919191919191919191919191919191",
      "bytes": 1024,
      "producer_role": "upstream-ref-resolver",
      "replay_critical": true
    },
    "replay.json": {
      "sha256": "ffffffffffffffffffffffffffffffffffffffffffffffffffffffffffffff10",
      "bytes": 4096,
      "producer_role": "steward",
      "replay_critical": true
    },
    "provenance.jsonl": {
      "sha256": "1010101010101010101010101010101010101010101010101010101010101010",
      "bytes": 2048,
      "producer_role": "steward",
      "replay_critical": false
    },
    "bundle.sig": {
      "sha256": "2020202020202020202020202020202020202020202020202020202020202010",
      "bytes": 256,
      "producer_role": "steward",
      "replay_critical": false
    },
    "repro-scoring-report.json": {
      "sha256": "5151515151515151515151515151515151515151515151515151515151515151",
      "bytes": 1024,
      "producer_role": "reproducer",
      "replay_critical": false
    },
    "review-scoring-report.json": {
      "sha256": "5252525252525252525252525252525252525252525252525252525252525252",
      "bytes": 1024,
      "producer_role": "reviewer",
      "replay_critical": false
    }
  },
  "signed_manifest": {
    "algorithm": "sigstore-cosign-v1",
    "signer": "fixture@example.invalid",
    "signed_files": [
      {
        "path": "bundle.json",
        "sha256": "aaaaaaaaaaaaaaaaaaaaaaaaaaaaaaaaaaaaaaaaaaaaaaaaaaaaaaaaaaaaaa10"
      },
      {
        "path": "finding.json",
        "sha256": "bbbbbbbbbbbbbbbbbbbbbbbbbbbbbbbbbbbbbbbbbbbbbbbbbbbbbbbbbbbbbb10"
      },
      {
        "path": "impact.json",
        "sha256": "dddddddddddddddddddddddddddddddddddddddddddddddddddddddddddddd10"
      },
      {
        "path": "maintainers.json",
        "sha256": "eeeeeeeeeeeeeeeeeeeeeeeeeeeeeeeeeeeeeeeeeeeeeeeeeeeeeeeeeeeeee10"
      },
      {
        "path": "upstream-ref.json",
        "sha256": "cccccccccccccccccccccccccccccccccccccccccccccccccccccccccccccc10"
      },
      {
        "path": "patch.diff",
        "sha256": "dddddddddddddddddddddddddddddddddddddddddddddddddddddddddddddddd"
      },
      {
        "path": "patch-rationale.md",
        "sha256": "4040404040404040404040404040404040404040404040404040404040404040"
      },
      {
        "path": "passthru-tests.json",
        "sha256": "5050505050505050505050505050505050505050505050505050505050505050"
      },
      {
        "path": "reproducer.nix",
        "sha256": "6161616161616161616161616161616161616161616161616161616161616161"
      },
      {
        "path": "review.md",
        "sha256": "8181818181818181818181818181818181818181818181818181818181818181"
      },
      {
        "path": "sbom-delta.json",
        "sha256": "9191919191919191919191919191919191919191919191919191919191919191"
      },
      {
        "path": "replay.json",
        "sha256": "ffffffffffffffffffffffffffffffffffffffffffffffffffffffffffffff10"
      }
    ]
  }
}
